ID;Title;Text
1;Что такое искусственный интеллект?;"Огромная волна интереса, развития мифов и различных страхов по отношению к искусственному интеллекту (ИИ) поднялась достаточно давно. По мнению исследователей, общество как раз находится на гребне данной волны, ведь фантастика в старых голливудских фильмах о роботах-убийцах и киборгах начинает сбываться, вспомним хотя бы фильм «Короткое замыкание» со слоганом «Номер пять - жив!», где небольшой боевой робот на гусеничном шасси, один из пяти, подвергается удару высокого напряжения и у него просыпается некоторый интеллект, робот начинает изучать мир по-своему. Прошло всего лишь около четверти века с момента выхода фильма, но уже сейчас нет никакой фантастики в происходящем на экране. Для искусственного интеллекта существует два основных определения: наука и технология создания интеллектуальных машин, особенно интеллектуальных компьютерных программ; свойство интеллектуальных систем выполнять творческие функции, которые традиционно считаются прерогативой человека. Так вот полноценный ИИ, который смог бы решать творческие задачи, т.е. такой, который отвечал бы второму определению, еще пока не создан, и пока нет каких-либо внятных идей о том как его создать. Заставить компьютер решать творческую задачу, чрезвычайно тяжело. На данный момент он способен только обрабатывать огромные объемы информации, и решать определённые задачи в соответствии с ранее запрограммированным алгоритмом. Если же рассмотреть первое определение ИИ, то на данный момент создано уже очень много устройств, программ и машин, которые подпадают под такое определение, и в таком случае, можно сказать, что определенными плодами работ над созданием искусственного интеллекта человечество уже давно пользуется. Каждый день мы слышим о проявлении ИИ и машинного обучения как совокупности мощных инструментов для интеллектуального анализа и синтеза различной информации, включая понимание человеческого языка и распознавание образов. Ярким примером является применение искусственного интеллекта при самостоятельном вождении автомобиля без помощи человека. Одновременно со всеми положительными возможностями ИИ у нас есть некоторая каста уважаемых мыслителей говорящих, что мы должны быть чрезвычайно бдительными в росте возможностей ИИ, потому что суперумные и мыслящие машины способны развить смертоносное презрение к нам, ведущее к гибели человечества. Эти же машины, могут и от """"великой (запрограммированной) любви"""" к человечеству, решить, что они обязаны захватить власть на Земле и обеспечить мир, покой и процветание человечества. И может здоровье и сытость людей в этом случае даже и вырастет под управлением умных машин, но вряд ли, тем не менее, кому-то из людей понравится такое положение дел. Существует и убеждение людей в том, что сверхразвитие ИИ просто невозможно, ведь машины никогда не будут в состоянии думать так же, как это делают люди. Между тем, очень хорошо финансируемые компании утверждают о способности обеспечить практически любое решение ИИ для вашего бизнеса сегодня. Стоит отметить, если некоторые люди думают, что никакой системе ИИ не убить нас, то безусловно не стоит забывать, что роботы и различные системы управления будут отнимать все наши рабочие места и вскоре смогут оставить без работы большую часть человечества. И хотя ясно, что в этом случае роботы сами же и произведут достаточно товаров для всех, и минимальные потребности безработных будут удовлетворены. Тем не менее, наличие огромных масс шатающихся без дела людей, может привести к непредсказуемым и серьезным социальным конфликтам, сдвигам и проблемам. В стремлении разумных людей прорваться через информационный шум и добраться до сути, чем же является ИИ и что он может сделать полезного для нас, и действительно ли мы должны беспокоиться о том, что роботы оставят нас без работы или убьют когда-нибудь во время сна — нет ничего странного, ведь в итоге каждому хочется спокойно жить. Многие из компаний уже используют различные возможности ИИ, осталось только заставить работать данный интеллект полностью в наших интересах. Наиболее вероятным негативным вариантом развития будет теория, где за мощью ИИ сможет стать злой гений человека и под диктатом этого злого гения ИИ сможет творить зло, но конечно не сам по себе, но как следствие воли человека. Ведь само по себе зло не может быть целью суперумного """"существа"""", такое """"существо"""" никогда не начнет действовать только ради того чтобы сотворить зло как таковое. Человечество может опасаться только того, что по своей """"воле"""" ИИ попытается принудить людей вести себя так, как ему будет казаться правильным, а не так как будут хотеть вести себя люди. В поисках далёкого будущего не стоит забывать о уже некоторых решаемых ИИ каждодневных задачах... Во-первых, ИИ позволит нам уже сегодня создавать системы в которых отсутствуют предрассудки и предубеждения человека, что исключит всякую коррупцию, симпатию и антипатию и так далее. Во-вторых, ИИ предоставляет мощные функциональные возможности, которые используются уже на рабочем месте самим человеком. В-третьих, умные машины являются единственным инструментом, которым мы сможем обработать огромные количества данных, которые как снежный ком растут вокруг нас. ИИ будет иметь возможность анализировать, интерпретировать и осмысливать данные в огромных масштабах, которые не представляется возможным для обработки нашим собственным умом. Да и честно говоря, ведь людям и не интересно сидеть и сутками обрабатывать сухие цифры, нам интересно делать выводы и принимать решения, на основе правильно обработанной и поданной информации (чем и занимается сегодня ИИ).В итоге мы имеем уменьшение использования человеческих ресурсов и перекладывание оных на ИИ, что позволяет нам тратить меньше времени на рутинные работы и оставляет больше времени на осмысление себя как человека и решение творческих задач, которые пока не способен решить ни один компьютер. И речь здесь идет не только о научных и технологических задачах, но и обо всех остальных творческих задачах, которые ставят и решают люди и только люди: как красивее построить, нарисовать, станцевать, спеть, как вкуснее приготовить, как проявить больше любви к ближнему, как подарить ему больше тепла, как лучше воспитать детей и так далее. Вот над решением каких вопросов смогут люди задумываться больше, если ИИ снимет с нас решение рутинных задач, обработку сухой информации, и даже производство и доставку базовых материальных ценностей."
2;Как изучить Data Science?;"Сферы нейронных сетей, а также Data Science набирают большую популярность. В статье вы узнаете что такое Data Science и как её можно изучить. Остались ли те, кто ещё ничего не знает о «big data»? Наверное, такого человека уже не найти. За последнее время интерес к данной отрасли значительно увеличился, особенно со стороны акул в сфере IT. Крупным компаниям, занимающимся IT, постоянно приходится изобретать всё лучшие решения, которые помогли бы работать с огромными объёмами данных. Хоть о данном вопросе уже слышали многие, но представление имеют лишь единицы. Мало, кто знает о специалистах в данной сфере и о том, чем они занимаются. Если у вас мало информации об этой сфере, но есть интерес, добро пожаловать к прочтению данного материала. Что делает отрасль Data Science? Data Analyst – это те сотрудники, у которых в обязанности входит обработка, анализ данных и переработка их в результаты понятные для человека. Сюда обычно относят спецов в машинном обучении, биг дата, data mining и аналитиков. Data Scientist - эксперты в сфере аналитической обработки информации, обладающие навыками для достижения относительно сложных целей. Конечно же, чертой хорошего специалиста является любопытство, за счёт которого и удаётся находить экстраординарные способы решения задач. Очень часто они имеют математические склонности ума, хорошо владеют компьютерами и всем, что с ними связано, а также от части являются трендспоттерами. От Data Scientist требуется наличие практических навыков и знаний, основанных на реальных проектах. Им нужно знать основные способы статистического анализа, уметь справляться с огромными базами данных, обладать способностью к нахождению закономерностей в этой информации. Одним из важнейших навыков является умение строить математические модели. Как стать специалистом в машинном обучении и Data Science? Существует множество уроков, книжек и материалов для изучения Data Science. Мы за самостоятельное изучение, но зачастую оно не дает нужного эффекта. Обучаясь со специалистами, вы получаете не только теорию и практику, но также поддержку со стороны лектора, новейшие материалы и реальный шанс на получение желаемой должности после обучения. В SkillFactory предлагают освоить специализацию в три этапа. У ребят открыт набор на курс ""Практический Machine Learning"", где под руководством опытного data scientist’а вы освоите все современные методы машинного обучения и научитесь работать с нейронными сетями. Этот курс даст возможность перейти на следующую ступень — Deep Learning, где вы пройдете полный путь от аренды GPU-сервера до создания полноценной рабочей модели для компьютерного зрения, анализа естественного языка и рекомендательных систем. А для желающих охватить сразу весь цикл обучения Data Science, начиная с изучения языка Python для анализа данных, классического машинного обучения и, наконец, перейти к нейросетям и deep learning, стартовал набор на курс ""Специализация Data Scientist"", после прохождения которого вы сможете на практике решать задачи машинного обучения и начать карьеру как Data Scientist. Что необходимо знать? Сфера Data Science довольно объёмная и, не будем скрывать, сложная. Поэтому к специалисту предъявляется немало требований. Ниже описаны основные знания, которыми нужно обладать. Визуализация массивов информации. Для лучшего понимания содержимого данных и их анализа нужно часто перерабатывать сухой текст в наглядную графику; Машинное обучение – это одно из направлений ИИ, в основе которого заложены математические начала и автоматизация; Глубокое обучение – это подвид машинного обучения, в котором применяются данные для создания моделей в сложных абстракциях; Определение образов является технологией, отвечающей за определение конкретных шаблонов среди всего потока данных. Часто применяется вместо машинного обучения; Сбор данных подразумевает получение информации в неподготовленном виде и переработка её в формат, который уже может использоваться человеком; Аналитика текстовых данных - анализ всей полученной информации для обнаружения закономерность и построения бизнес-идей. В дополнение к выше перечисленному следует иметь уверенное понимание: Принципов статистики; Статических языков программирования, лучший из них Python, но также часто используется SAS и R; Основных баз данных: Postgres и MySQL; Компьютерных технологий по визуализации информации; Набора Hadoop и модели MapReduce. Зарплаты В нынешнем состоянии рынка труда, Data Scientist в Америке в среднем зарабатывают $91 тысячу, но всё зависит от опыта. Ниже приведён скриншот зависимости заработной платы от опыта. В отечественных реалиях эта цифра намного меньше. Начинающий специалист может получать около 60-90 тысяч рублей ежемесячно. Заработок экспертов доходит до 220 тысяч рублей. Что конкретно делают работники этой сферы? Какие поручения выполняют специалисты в ежедневной рутине? Их жизнь постоянно связана с ограничениями, которые препятствую в реализации новых решений. Норма жизни Big Data спецов – решение методологических, технических и других проблем. Им постоянно приходится анализировать, открывать новые закономерности и строить прогнозы. Это по большей части научная сфера, в которой есть и доля творчества. Специалисты должны иметь незаурядную смекалку, которая поможет им находить решения трудных задач. Творческая нотка поможет им в удачной визуализации данных. Для примера рассмотрим жизненную задачу Data Scientist: «Джонатант Голдман – это специалист в сфере физики, проходящий обучение в Стэнфорде. Он получил работу в известной соцсети LinkedIn и в его обязанности входила работа, которую нельзя замерить по KPI или увидеть её наглядный результат. Работа заключалась в искоренении багов сайта и внедрении фич. Остальная часть разработчиков постоянно раздумывала о способах модернизации сайта и увеличении его пропускной способности. Голдман отвечал за разработку системы, которая бы подсказывала пользователю профиля, кто ещё на сайте может быть ему знакомым. Голдман добился того, чтобы компания попробовала внедрить данную модель. Он принёс социальной сети миллионы дополнительных просмотров, а значит – существенно ускорил её развитие». Не существует какого-то универсального определения данной профессии, очень многое зависит от направления деятельности. Тем не менее есть те задачи, которые выполняет каждый из Data Scientist: Сбор огромного объёма неупорядоченных данных и их переработка в доступный для понимания формат. Достижение бизнес-задач, связанных с применением данных; Применение нескольких языков программирования; Постоянная работа со статистикой; Применение аналитических способов структурирования данных; Баланс между ИТ и бизнесом; Поиск закономерностей и создание шаблонов, выявление трендов и тенденций, что можно использовать компанией для увеличения заработка."
